{
  "id": "sinergia-animal--food-policy-lead-argentina--2026-01",
  "title": "Food Policy Lead, Argentina",
  "organization": "sinergia-animal",
  "source": "80k-hours",
  "source_url": "https://www.sinergiaanimalinternational.org/food-policy-lead-argentina",
  "jd_file": "data/jds/sinergia-animal--food-policy-lead-argentina--2026-01.md",
  "location": {
    "type": "onsite",
    "cities": [
      "Buenos Aires, Argentina"
    ]
  },
  "salary": null,
  "posted_date": "2026-01-19",
  "deadline": null,
  "date_added": "2026-02-28",
  "tags": [
    "animal-welfare",
    "full-time",
    "outreach",
    "operations"
  ],
  "status": "unknown",
  "confidence": 1.0,
  "notes": null
}
