{
  "id": "institute-for-law-and-ai--director-of-talent-recruitment-manager--2026-02",
  "title": "Director of Talent / Recruitment Manager",
  "organization": "institute-for-law-and-ai",
  "source": "80k-hours",
  "source_url": "https://law-ai.org/career/director-of-talent/",
  "jd_file": "data/jds/institute-for-law-and-ai--director-of-talent-recruitment-manager--2026-02.md",
  "location": {
    "type": "remote",
    "cities": [
      "Cambridge, UK"
    ]
  },
  "salary": {
    "currency": "USD",
    "period": "annual",
    "min": 90000.0,
    "max": 180000.0
  },
  "posted_date": "2026-02-06",
  "deadline": "2026-03-06",
  "date_added": "2026-02-28",
  "tags": [
    "ai-safety-policy",
    "full-time",
    "operations"
  ],
  "status": "unknown",
  "confidence": 1.0,
  "notes": null
}
