{
  "id": "yale-university-tobin-center-for-economic-policy--pre-doctoral-fellows-program--2022-01",
  "title": "Pre-Doctoral Fellows Program",
  "organization": "yale-university-tobin-center-for-economic-policy",
  "source": "80k-hours",
  "source_url": "https://tobin.yale.edu/programs/pre-doctoral-fellows-program",
  "jd_file": "data/jds/yale-university-tobin-center-for-economic-policy--pre-doctoral-fellows-program--2022-01.md",
  "location": {
    "type": "onsite",
    "cities": [
      "New Haven, CT"
    ]
  },
  "salary": null,
  "posted_date": "2022-01-02",
  "deadline": null,
  "date_added": "2026-02-28",
  "tags": [
    "other-policy-focused",
    "full-time",
    "research",
    "policy"
  ],
  "status": "unknown",
  "confidence": 1.0,
  "notes": null
}
