{
  "id": "mozilla-foundation--incubator-democracy-x-ai-cohort--2026-02",
  "title": "Incubator, Democracy x AI Cohort",
  "organization": "mozilla-foundation",
  "source": "80k-hours",
  "source_url": "https://www.mozillafoundation.org/en/what-we-do/grantmaking/incubator/democracy-ai-cohort/",
  "jd_file": "data/jds/mozilla-foundation--incubator-democracy-x-ai-cohort--2026-02.md",
  "location": {
    "type": "remote"
  },
  "salary": {
    "currency": "USD",
    "period": "annual",
    "min": 50000.0,
    "max": 50000.0
  },
  "posted_date": "2026-02-24",
  "deadline": "2026-03-16",
  "date_added": "2026-02-28",
  "tags": [
    "funding",
    "software-engineering",
    "strategy"
  ],
  "status": "unknown",
  "confidence": 1.0,
  "notes": null
}
