{
  "id": "us-government-defense-advanced-research-projects-agency--innovation-fellowship--2022-01",
  "title": "Innovation Fellowship",
  "organization": "us-government-defense-advanced-research-projects-agency",
  "source": "80k-hours",
  "source_url": "https://www.darpa.mil/careers/innovation-fellowship#apply",
  "jd_file": "data/jds/us-government-defense-advanced-research-projects-agency--innovation-fellowship--2022-01.md",
  "location": {
    "type": "remote"
  },
  "salary": null,
  "posted_date": "2022-01-01",
  "deadline": null,
  "date_added": "2026-02-28",
  "tags": [
    "other-policy-focused",
    "fellowship",
    "research",
    "policy"
  ],
  "status": "unknown",
  "confidence": 1.0,
  "notes": null
}
