{
  "id": "anthropic--research-engineer-interpretability--2022-01",
  "title": "Research Engineer, Interpretability",
  "organization": "anthropic",
  "source": "80k-hours",
  "source_url": "https://job-boards.greenhouse.io/anthropic/jobs/4980430008",
  "jd_file": "data/jds/anthropic--research-engineer-interpretability--2022-01.md",
  "location": {
    "type": "onsite",
    "cities": [
      "San Francisco Bay Area"
    ]
  },
  "salary": {
    "currency": "USD",
    "period": "annual",
    "min": 315000.0,
    "max": 560000.0
  },
  "posted_date": "2022-01-11",
  "deadline": null,
  "date_added": "2026-02-28",
  "tags": [
    "ai-safety-policy",
    "full-time",
    "research",
    "software-engineering"
  ],
  "status": "unknown",
  "confidence": 1.0,
  "notes": null
}
