{
  "id": "gates-foundation--senior-program-officer-tb-hiv-diagnostics-research-and-development--2026-02",
  "title": "Senior Program Officer, TB / HIV Diagnostics Research and Development",
  "organization": "gates-foundation",
  "source": "80k-hours",
  "source_url": "https://gatesfoundation.wd1.myworkdayjobs.com/en-US/Gates/job/Seattle-WA/Senior-Program-Officer--TB-HIV-Diagnostics-Research---Development_B021367-1",
  "jd_file": "data/jds/gates-foundation--senior-program-officer-tb-hiv-diagnostics-research-and-development--2026-02.md",
  "location": {
    "type": "onsite",
    "cities": [
      "Seattle metro area"
    ]
  },
  "salary": {
    "currency": "USD",
    "period": "annual",
    "min": 212800.0,
    "max": 362800.0
  },
  "posted_date": "2026-02-25",
  "deadline": null,
  "date_added": "2026-02-28",
  "tags": [
    "global-health-development",
    "full-time",
    "strategy"
  ],
  "status": "unknown",
  "confidence": 1.0,
  "notes": null
}
