{
  "id": "80000-hours--get-career-advising--2020-01",
  "title": "Get Career Advising",
  "organization": "80000-hours",
  "source": "80k-hours",
  "source_url": "https://80000hours.org/speak-with-us/?int_campaign=job-board",
  "jd_file": "data/jds/80000-hours--get-career-advising--2020-01.md",
  "location": {
    "type": "remote"
  },
  "salary": null,
  "posted_date": "2020-01-01",
  "deadline": null,
  "date_added": "2026-02-28",
  "tags": [
    "ai-safety-policy",
    "other",
    "engineering",
    "research",
    "policy",
    "outreach",
    "operations",
    "other",
    "software-engineering",
    "legal",
    "information-security",
    "management",
    "data",
    "finance",
    "strategy"
  ],
  "status": "unknown",
  "confidence": 1.0,
  "notes": null
}
