{
  "id": "animal-equality--fundraising-manager--2022-01",
  "title": "Fundraising Manager",
  "organization": "animal-equality",
  "source": "80k-hours",
  "source_url": "https://animalequality.it/lavora-con-noi/responsabile-raccolta-fondi/",
  "jd_file": "data/jds/animal-equality--fundraising-manager--2022-01.md",
  "location": {
    "type": "remote"
  },
  "salary": null,
  "posted_date": "2022-01-01",
  "deadline": null,
  "date_added": "2026-02-28",
  "tags": [
    "animal-welfare",
    "full-time",
    "outreach"
  ],
  "status": "unknown",
  "confidence": 1.0,
  "notes": null
}
