{
  "id": "tarbell-center-for-ai-journalism--program-director-grants--2026-02",
  "title": "Program Director, Grants",
  "organization": "tarbell-center-for-ai-journalism",
  "source": "80k-hours",
  "source_url": "https://www.tarbellcenter.org/grants-program-director",
  "jd_file": "data/jds/tarbell-center-for-ai-journalism--program-director-grants--2026-02.md",
  "location": {
    "type": "onsite",
    "cities": [
      "London, UK",
      "Washington, DC metro area",
      "San Francisco Bay Area",
      "New York, NY"
    ]
  },
  "salary": {
    "currency": "GBP",
    "period": "annual",
    "min": 140000.0,
    "max": 190000.0
  },
  "posted_date": "2026-02-09",
  "deadline": "2026-03-08",
  "date_added": "2026-02-28",
  "tags": [
    "ai-safety-policy",
    "full-time",
    "management",
    "strategy"
  ],
  "status": "unknown",
  "confidence": 1.0,
  "notes": null
}
