{
  "id": "centre-for-effective-altruism--expression-of-interest--2022-01",
  "title": "Expression of Interest",
  "organization": "centre-for-effective-altruism",
  "source": "80k-hours",
  "source_url": "https://www.centreforeffectivealtruism.org/careers?ashby_jid=372827d7-ca62-49a6-bc75-077e63398577",
  "jd_file": "data/jds/centre-for-effective-altruism--expression-of-interest--2022-01.md",
  "location": {
    "type": "remote"
  },
  "salary": null,
  "posted_date": "2022-01-07",
  "deadline": null,
  "date_added": "2026-02-28",
  "tags": [
    "building-effective-altruism",
    "full-time",
    "outreach",
    "operations"
  ],
  "status": "unknown",
  "confidence": 1.0,
  "notes": null
}
