{
  "id": "pure-earth--program-management-consultant-rwanda--2026-02",
  "title": "Program Management Consultant, Rwanda",
  "organization": "pure-earth",
  "source": "80k-hours",
  "source_url": "https://www.pureearth.org/wp-content/uploads/2026/02/Program-Manager-Consultant-Rwanda-.pdf",
  "jd_file": "data/jds/pure-earth--program-management-consultant-rwanda--2026-02.md",
  "location": {
    "type": "remote"
  },
  "salary": null,
  "posted_date": "2026-02-13",
  "deadline": null,
  "date_added": "2026-02-28",
  "tags": [
    "global-health-development",
    "full-time",
    "outreach",
    "strategy"
  ],
  "status": "unknown",
  "confidence": 1.0,
  "notes": null
}
