{
  "id": "center-for-ai-risk-management-and-alignment--senior-technical-specialist-ai-risk-assessment--2022-01",
  "title": "Senior Technical Specialist, AI Risk Assessment",
  "organization": "center-for-ai-risk-management-and-alignment",
  "source": "80k-hours",
  "source_url": "https://jobs.lever.co/futureof-life/a72cd411-9af3-458a-932b-16cca3ce07dd",
  "jd_file": "data/jds/center-for-ai-risk-management-and-alignment--senior-technical-specialist-ai-risk-assessment--2022-01.md",
  "location": {
    "type": "remote"
  },
  "salary": {
    "currency": "USD",
    "period": "annual",
    "min": 140000.0,
    "max": 220000.0
  },
  "posted_date": "2022-01-05",
  "deadline": null,
  "date_added": "2026-02-28",
  "tags": [
    "ai-safety-policy",
    "full-time",
    "research",
    "strategy"
  ],
  "status": "unknown",
  "confidence": 1.0,
  "notes": null
}
