{
  "id": "openai--researcher-robustness-and-safety-training-safety-systems--2025-12",
  "title": "Researcher, Robustness and Safety Training, Safety Systems",
  "organization": "openai",
  "source": "80k-hours",
  "source_url": "https://openai.com/careers/researcher-robustness-and-safety-training-san-francisco/",
  "jd_file": "data/jds/openai--researcher-robustness-and-safety-training-safety-systems--2025-12.md",
  "location": {
    "type": "onsite",
    "cities": [
      "San Francisco Bay Area"
    ]
  },
  "salary": {
    "currency": "USD",
    "period": "annual",
    "min": 310000.0,
    "max": 460000.0
  },
  "posted_date": "2025-12-26",
  "deadline": null,
  "date_added": "2026-02-28",
  "tags": [
    "ai-safety-policy",
    "full-time",
    "research"
  ],
  "status": "unknown",
  "confidence": 1.0,
  "notes": null
}
