{
  "id": "us-government-department-of-energy--fellowship-science-technology-and-policy-program-office-of-policy--2022-01",
  "title": "Fellowship, Science, Technology and Policy Program, Office of Policy",
  "organization": "us-government-department-of-energy",
  "source": "80k-hours",
  "source_url": "https://www.zintellect.com/Opportunity/Details/DOE-STP-OP-2025-0001",
  "jd_file": "data/jds/us-government-department-of-energy--fellowship-science-technology-and-policy-program-office-of-policy--2022-01.md",
  "location": {
    "type": "onsite",
    "cities": [
      "Washington, DC metro area"
    ]
  },
  "salary": null,
  "posted_date": "2022-01-03",
  "deadline": null,
  "date_added": "2026-02-28",
  "tags": [
    "other-policy-focused",
    "fellowship",
    "research",
    "policy"
  ],
  "status": "unknown",
  "confidence": 1.0,
  "notes": null
}
