{
  "id": "us-government-congressional-research-service--volunteer-internship-program--2022-01",
  "title": "Volunteer Internship Program",
  "organization": "us-government-congressional-research-service",
  "source": "80k-hours",
  "source_url": "https://www.loc.gov/crsinfo/opportunities/volunteer.html",
  "jd_file": "data/jds/us-government-congressional-research-service--volunteer-internship-program--2022-01.md",
  "location": {
    "type": "onsite",
    "cities": [
      "Washington, DC metro area"
    ]
  },
  "salary": null,
  "posted_date": "2022-01-02",
  "deadline": null,
  "date_added": "2026-02-28",
  "tags": [
    "other-policy-focused",
    "internship",
    "research",
    "policy",
    "operations"
  ],
  "status": "unknown",
  "confidence": 1.0,
  "notes": null
}
