{
  "id": "various-venture-backed-startups--list-of-places-to-find-roles-at-top-startup-companies--2025-12",
  "title": "List of Places to Find Roles at Top Startup Companies",
  "organization": "various-venture-backed-startups",
  "source": "80k-hours",
  "source_url": "https://airtable.com/app53PsYpHxJW61l3/shr303f0nPKns4n45",
  "jd_file": "data/jds/various-venture-backed-startups--list-of-places-to-find-roles-at-top-startup-companies--2025-12.md",
  "location": {
    "type": "remote",
    "cities": [
      "Various, Global"
    ]
  },
  "salary": null,
  "posted_date": "2025-12-11",
  "deadline": null,
  "date_added": "2026-02-28",
  "tags": [
    "technical",
    "full-time",
    "research",
    "operations",
    "management",
    "data",
    "strategy"
  ],
  "status": "unknown",
  "confidence": 1.0,
  "notes": null
}
