{
  "id": "arms-control-association--intern-nuclear-policy-research--2022-01",
  "title": "Intern, Nuclear Policy Research",
  "organization": "arms-control-association",
  "source": "80k-hours",
  "source_url": "https://www.armscontrol.org/internships",
  "jd_file": "data/jds/arms-control-association--intern-nuclear-policy-research--2022-01.md",
  "location": {
    "type": "onsite",
    "cities": [
      "Washington, DC metro area"
    ]
  },
  "salary": null,
  "posted_date": "2022-01-02",
  "deadline": null,
  "date_added": "2026-02-28",
  "tags": [
    "nuclear-security",
    "internship",
    "research",
    "policy"
  ],
  "status": "unknown",
  "confidence": 1.0,
  "notes": null
}
