{
  "id": "gi-effektivt--head-of-growth-and-communications--2022-01",
  "title": "Head of Growth and Communications",
  "organization": "gi-effektivt",
  "source": "80k-hours",
  "source_url": "https://gieffektivt.no/ledige-stillinger",
  "jd_file": "data/jds/gi-effektivt--head-of-growth-and-communications--2022-01.md",
  "location": {
    "type": "onsite",
    "cities": [
      "Oslo, Norway"
    ]
  },
  "salary": null,
  "posted_date": "2022-01-01",
  "deadline": "2026-03-15",
  "date_added": "2026-02-28",
  "tags": [
    "building-effective-altruism",
    "full-time",
    "outreach"
  ],
  "status": "unknown",
  "confidence": 1.0,
  "notes": null
}
